Word,PartsOfSpeech,Synonyms,Usage,Antonyms,RelatedPartsOfSpeech,
secrete,v,"(of a cell, gland, or organ) produce and discharge (a substance); emit; excrete; exude; ooze; leak",insulin is secreted in response to rising levels of glucose in the blood,,,
secular,adj.,of or relating to the world or worldly matters (as opposed to spiritual),,,,
sediment,n.,material that settles at the bottom of a body of water,,,,
sedulous,adj.,dedicated and careful; dilligent,Roma is so sedulous that she get commendation for her hand work,,,
sentient,,conscious; experiencing sensation,,,,
serendipity,,gift of finding items by accident/luck,,,,
sham,,pretense; fake; act,,,,
shard,,fragment (generally of pottery),,,,
simpleton,n.,fool; dull; dullard; ignoramus; idiot; imbecile; nincompoop; dunce,,,,
simultaneous,adj.,occurring at the same moment,,,,
skeptic,,doubter; doubtful,,,,
skirt,,border; lie along the edge of; go around,,,,
slack ,,loose; negligent; lazy; weak,,,,
slew,,large number,,slight; small; slender,,
snare (for),v,trap,,,,
solicitous,adj.,considerate; attentive; worried; anxious; concerned,Mom is solicitous about babies health,,,
soporific,adj.,sleep-causing; makes sleepy,,,,
sparse,adj.,scattered; scarce; austere and unadorned,,,,
spartan,,very disciplined; stern; frugal; austere; lacking luxary and comfort,,,,
spate,,sudden flood,,,,
spearhead,,be leader of,,,,
specious,adj.,deceptive; spurious; appearing true but actually false,,,,
spectrum,,broad range of qualities and ideas,,,,
speculate,,contemplate; make an educated guess,,,,
sporadic,adj.,occasional or scattered,,,,
sportive,,playful; merry,,,,
spurious,adj.,fake or false,Claiming bird and houses both can fly is a spurious claim.,,,
standing,,rank; status; reputation,,,,
stark,,complete; total; utter; harsh; grim; blunt; plain,,,,
status quo,,existing state; existing condition,,,,
stigmatization,,action of describing someone worthy of disgrace,,,,
stingy,,not generous with money,,,,
stint,,be thrifty; set limits,"Spare no limits in marriage, refuse to stint",,,
stipulate,,"make express conditions; specify (a requirement), typically as part of an agreement",President stipulated the conditions before sending aid to Syria.,,,
stoic,,indifferent to pleasure; enduring without complaint,,,,
stolid,adj.,calm and dependable; dull; impassive; unemotional,,,,
strident,,loud and harsh,Can not hear amidst strident cries,,,
stringent,,binding; strict; rigid,Immigration regulations are getting stringent in US.,,,
stymie,,block; hinder; thwart; obstacle,,,,
subdue,,muted; toned down; softened; soft; lowered,,,,
subjective,adj.,open to personal interpretation; not based in objective fact,,,,
subpoena,,summoning someone to court,,,,
subside,,settle down; descend; grow quiet,Fever will subside with time,,,
subside,,sink; settle down,,,,
substantiate,v.,to corroborate or give evidence of something; verify by evidence,,,,
subversive,,destructive; tending to throw,Plastic cups are subversive to the environment,,,
subversive,adj.,meant to undercut established institutions or norms; tending to overthrow; destructive,,,,
succeeding,,coming after; following,,,,
succinct,,briefly and clearly expressed; concise; short; terse; compact; condensed; crisp; laconic,express your thoughts succinctly,,,
sufficient,adj.,enough for a given purpose,,,,
suffrage,n.,voting rights in political elections; franchise; enfranchisement,universal adult suffrage,,,
superbly,adv.,excellently,,,,
superior,one,,,,,
supersede,,replace; make obsolete,,,,
supine,,lying down; recumbent ,,,,
supine,adj.,laying back with the face upward (opposite position to prone),,,,
supplant,v.,to overtake or replace; usurp; seize; take over; expropriate,,,,
supplicate,,pray; humbly ask; beg,,,,
supposition,,hypothesis; surmise,,,,
surfeit,,excess; excessive amount,,,,
surmise,,guess; infer; think,,,,
susceptible,adj,impressionable; easily influenced; receptive to; vulnerable to,,,,
sycophant,n.,a fawning; insincere admirer; boot-licker; yes man,,,,
synchronous,,happening at the same time,,,,
synthesize,v.,to combine disparate parts into a coherent whole,,,,
table,,lay aside to discuss later,,,,
tacit,adj.,unspoken; implicit; understood; not put into words,,,,
taciturn,adj.,reticent or reserved; tending towards silence; habitually silent,,,,
tangential,,slightly relevant; going off-topic; peripheral; only slightly connected; digressing,Tangential remarks were made to distract Mary but she was coming back to original question. ,,,
tangled,,twisted together untidily; matted,,,,
tantamount,,equivalent in effect/value,,,,
temperance,n.,moderation and restraint; abstinence (from alcohol),,,,
tenuous,adj.,weak; long and thin; flimsy; insubstantial,,,,
tepid,,lukewarm,,,,
timorous,adj.,meek; timid; fearful,,,,
tirade,n.,an angry rant; diatribe; extended scolding; denunciation,,,,
torpor,n.,tiredness; dormancy; lethargy; sluggishness,During winter bear does not arouse from torpor,,,
torrid,,passionate; hot scorching; parching,,,,
tortuous,adj.,winding or twisty; complicated,The road is so tortuous that driving is super tough.,,,
tractable,,controllable; managable; malleable,Tractable dogs had obediance training,,,
tractable,adj.,can be easily influenced or managed; docile; obedient,,,,
tranquility,,calm; peaceful,,,,
transcend,,surpass; excel,,,,
transgression,,violation of law; sin,Cop ignored the the traffic transgression,,,
transient,adj.,passes quickly; short-lived,,,,
transitory,,temporary; short lived; not lasting,,,,
trifling,,trivial; frivolous; shallow; unimportant,,,,
trite,,hackneyed; commonplace,,,,
truculence,,agressiveness; ferocious; ferocity,,,,
tumult,,commotion; riot; noise,,,,
ubiquitous,adj.,ever-present; exist everywhere; universal,,,,
unadorned,adj.,plain; unembellished,,,,
undermine,v.,to weaken or compromise,Corruption undermined peoples' trust.,,,
underreported,,fail to report (something) fully,,,,
underscore,v.,to line underneath for emphasis; to emphasize,Underscored the importance of nutrition.,,,
unearth,,dig up,,,,
unequivocal,,plain; obvious,,equivocal,,
unprecedented,,novel; unparalleled; never seen before,,,,
unpretentiousness,,not attempting to pretend to be superior; unaffected; modest; unassuming; without airs; natural,,,,
unscrupulous,,unprincipled; unethical,,scrupulous; conscientious; extremely through,,
unseemly,,improper; indecent,,,,
unsound,,rickety; filmsy; shaky; wobbly,,,,
untenable,adj.,weak or unsupportable,esp. with respect to an opinion or,,,
untenable,,weak; unsupportive; indefensible,,,,
urbane,,suave; elegant,,,,
vacillate,v.,to shift between multiple options or opinions; waver; fluctuate; sway,,,,
vehement,,forceful; intensely emotional; with marked vigor,Alfred became vehement as he started loosing money in stick market,,,
venality,n.,the state of being capable of being bribed,,,,
vendetta,,blood feud,Mobs engaged in a bitter vendetta,,,
venerate,v.,to give a high degree of respect; may border on worship; revere; exalt; honor; esteem,Tibetians venerate Dalai Lama.,,,
veracious,adj.,truthful,People who are honest and veracious can be trustworthy,,veracity (n),
veracity,n.,truth and factual accuracy; truthfulness,,,,
verbose,adj.,long-winded; wordy; loquacious,,,,
vexation,n.,state of being frustrated; irritated; ,,,,
viable,,practical; workable,,,,
vindicate,,clear from blame; exonerate; justify; support,,,,
vindictive,,out for revenge; mallacious,Divorce sometimes brings the vindictive streak in people,,,
vintage,,high quality item of previous era,,,,
virtual,,in essence; for practical purposes,,,,
viscous,,sticky; gluey,Melted tar is viscous,,,
vituperative,,abuse; scolding; verbal abuse; rebuke; criticize harshly,Mary became vituperative as mom rejected her wish.,,,
volatile,,varying; inconcistent,,,,
volatile,adj.,easily changeable or extreme; unstable; evaporating rapidly; fraught,,,,
warranted,,justified; authorized,To get mercy you must convince judge that your action is warranted.,,,
wary,,watchful; motivated; very cautious,Spies wary as they put their life on stake to collect information.,,,
welter,n.,turmoil; bewildering; jumble,The welter of India and Pakistan over Kashmir makes the situation worse.,,,
welter,v.,wallow,After battle soldiers weltered in their blood.,,,
whereas,,while on contrary,,,,
whimsical,adj.,fanciful; capricious,Mrs Doubtfire is whimsical,,,
wily,adj.,crafty; cunning,Alexia is wily as a fox to win any argument.,,,
woo,,seek favor; seek support,,,,
wreak,v.,inflict,Do not wreak your vengeance (or revenge) on the new comers.,,,
zeal,n.,passion; fervor; eager enthusiasm,Max zeal is encouraging the whole class to attend the College football match.,,,
zealot,n.,fanatic person with excessive zeal,Max is zealot about Manchester United as he never missed a single match  of them.,,,